{
  "metadata": {
    "scale": 20,
    "ceilingHeight": 2700,
    "planWidth": 12000,
    "planHeight": 8000,
    "sourceImage": "sample-2bed.png"
  },
  "walls": [
    { "id": "w0",  "start": [0, 0],       "end": [12000, 0],     "thickness": 200 },
    { "id": "w1",  "start": [12000, 0],    "end": [12000, 8000],  "thickness": 200 },
    { "id": "w2",  "start": [12000, 8000], "end": [0, 8000],      "thickness": 200 },
    { "id": "w3",  "start": [0, 8000],     "end": [0, 0],         "thickness": 200 },

    { "id": "w4",  "start": [5000, 0],     "end": [5000, 4500],   "thickness": 150 },
    { "id": "w5",  "start": [5000, 4500],  "end": [8500, 4500],   "thickness": 150 },
    { "id": "w6",  "start": [8500, 4500],  "end": [8500, 8000],   "thickness": 150 },

    { "id": "w7",  "start": [0, 4500],     "end": [5000, 4500],   "thickness": 150 },

    { "id": "w8",  "start": [8500, 0],     "end": [8500, 4500],   "thickness": 150 },

    { "id": "w9",  "start": [5000, 6500],  "end": [8500, 6500],   "thickness": 100 },

    { "id": "w10", "start": [5000, 4500],  "end": [5000, 8000],   "thickness": 150 }
  ],
  "openings": [
    { "id": "o0", "wallId": "w4",  "position": 0.55, "type": "door", "width": 900, "height": 2100, "sillHeight": 0 },
    { "id": "o1", "wallId": "w7",  "position": 0.5,  "type": "door", "width": 900, "height": 2100, "sillHeight": 0 },
    { "id": "o2", "wallId": "w8",  "position": 0.5,  "type": "door", "width": 900, "height": 2100, "sillHeight": 0 },
    { "id": "o3", "wallId": "w10", "position": 0.35, "type": "door", "width": 800, "height": 2100, "sillHeight": 0 },
    { "id": "o4", "wallId": "w9",  "position": 0.5,  "type": "door", "width": 800, "height": 2100, "sillHeight": 0 },
    { "id": "o5", "wallId": "w6",  "position": 0.5,  "type": "door", "width": 900, "height": 2100, "sillHeight": 0 },

    { "id": "o6", "wallId": "w0",  "position": 0.25, "type": "window", "width": 1800, "height": 1200, "sillHeight": 900 },
    { "id": "o7", "wallId": "w0",  "position": 0.75, "type": "window", "width": 1800, "height": 1200, "sillHeight": 900 },
    { "id": "o8", "wallId": "w1",  "position": 0.3,  "type": "window", "width": 1500, "height": 1200, "sillHeight": 900 },
    { "id": "o9", "wallId": "w2",  "position": 0.75, "type": "window", "width": 1200, "height": 1200, "sillHeight": 900 }
  ],
  "rooms": [
    {
      "id": "r0", "label": "Living / Kitchen",
      "polygon": [[5000, 4500], [12000, 4500], [12000, 8000], [5000, 8000]]
    },
    {
      "id": "r1", "label": "Master Bedroom",
      "polygon": [[0, 0], [5000, 0], [5000, 4500], [0, 4500]]
    },
    {
      "id": "r2", "label": "Bedroom 2",
      "polygon": [[5000, 0], [8500, 0], [8500, 4500], [5000, 4500]]
    },
    {
      "id": "r3", "label": "Ensuite",
      "polygon": [[8500, 0], [12000, 0], [12000, 4500], [8500, 4500]]
    },
    {
      "id": "r4", "label": "Bathroom",
      "polygon": [[5000, 4500], [8500, 4500], [8500, 6500], [5000, 6500]]
    },
    {
      "id": "r5", "label": "Laundry",
      "polygon": [[5000, 6500], [8500, 6500], [8500, 8000], [5000, 8000]]
    },
    {
      "id": "r6", "label": "Entry / Hall",
      "polygon": [[0, 4500], [5000, 4500], [5000, 8000], [0, 8000]]
    }
  ],
  "furniture": [
    { "id": "f0",  "type": "bed_double",      "position": [2500, 2000],  "rotation": 0,   "width": 1600, "depth": 2000 },
    { "id": "f1",  "type": "wardrobe",         "position": [500, 2250],   "rotation": 90,  "width": 2000, "depth": 600 },
    { "id": "f2",  "type": "desk",             "position": [4500, 500],   "rotation": 0,   "width": 1200, "depth": 600 },

    { "id": "f3",  "type": "bed_single",       "position": [6750, 2000],  "rotation": 0,   "width": 1000, "depth": 2000 },
    { "id": "f4",  "type": "wardrobe",         "position": [5300, 1500],  "rotation": 90,  "width": 1500, "depth": 600 },

    { "id": "f5",  "type": "toilet",           "position": [9200, 1500],  "rotation": 270, "width": 400,  "depth": 700 },
    { "id": "f6",  "type": "sink",             "position": [9200, 500],   "rotation": 270, "width": 500,  "depth": 450 },
    { "id": "f7",  "type": "shower",           "position": [11000, 1500], "rotation": 0,   "width": 900,  "depth": 900 },

    { "id": "f8",  "type": "toilet",           "position": [5500, 5500],  "rotation": 90,  "width": 400,  "depth": 700 },
    { "id": "f9",  "type": "sink",             "position": [7500, 4800],  "rotation": 180, "width": 500,  "depth": 450 },
    { "id": "f10", "type": "bathtub",          "position": [7500, 5800],  "rotation": 0,   "width": 800,  "depth": 1700 },

    { "id": "f11", "type": "washing_machine",  "position": [7500, 7200],  "rotation": 0,   "width": 600,  "depth": 600 },

    { "id": "f12", "type": "sofa",             "position": [10500, 6500], "rotation": 0,   "width": 2200, "depth": 900 },
    { "id": "f13", "type": "dining_table",     "position": [10000, 5200], "rotation": 0,   "width": 1600, "depth": 900 },
    { "id": "f14", "type": "chair",            "position": [9800, 4700],  "rotation": 180, "width": 450,  "depth": 450 },
    { "id": "f15", "type": "chair",            "position": [10200, 4700], "rotation": 180, "width": 450,  "depth": 450 },
    { "id": "f16", "type": "chair",            "position": [9800, 5700],  "rotation": 0,   "width": 450,  "depth": 450 },
    { "id": "f17", "type": "chair",            "position": [10200, 5700], "rotation": 0,   "width": 450,  "depth": 450 },
    { "id": "f18", "type": "kitchen_counter",  "position": [6500, 7500],  "rotation": 0,   "width": 3000, "depth": 600 },
    { "id": "f19", "type": "fridge",           "position": [5500, 7500],  "rotation": 90,  "width": 700,  "depth": 700 }
  ]
}
